{
  "$schema": "https://json-schema.org/draft/2020-12/schema",
  "$id": "https://schemas.samsarix.com/spirals/workflow-v1.schema.json",
  "title": "Samsarix Spirals workflow version 1",
  "description": "Structural schema for deterministic Samsarix Spirals workflows.",
  "$comment": "Runtime validation remains authoritative for byte, depth, total-value, template-reference, and unique-step-ID constraints.",
  "type": "object",
  "additionalProperties": false,
  "required": ["schema_version", "name", "steps"],
  "properties": {
    "schema_version": {
      "const": 1
    },
    "name": {
      "type": "string",
      "minLength": 1,
      "maxLength": 100,
      "pattern": "\\S"
    },
    "description": {
      "type": ["string", "null"],
      "maxLength": 500
    },
    "defaults": {
      "type": "object",
      "maxProperties": 10000,
      "additionalProperties": {
        "$ref": "#/$defs/jsonValue"
      }
    },
    "steps": {
      "type": "array",
      "minItems": 1,
      "maxItems": 1000,
      "items": {
        "$ref": "#/$defs/step"
      }
    },
    "output": {
      "$ref": "#/$defs/jsonValue"
    }
  },
  "$defs": {
    "jsonValue": {
      "oneOf": [
        {
          "type": ["string", "number", "boolean", "null"],
          "maxLength": 100000
        },
        {
          "type": "array",
          "maxItems": 10000,
          "items": {
            "$ref": "#/$defs/jsonValue"
          }
        },
        {
          "type": "object",
          "maxProperties": 10000,
          "additionalProperties": {
            "$ref": "#/$defs/jsonValue"
          }
        }
      ]
    },
    "exactTemplate": {
      "type": "string",
      "maxLength": 100000,
      "pattern": "^\\{\\{\\s*[A-Za-z][A-Za-z0-9_-]*(?:\\.[A-Za-z0-9_-]+)*\\s*\\}\\}$"
    },
    "step": {
      "oneOf": [
        {
          "$ref": "#/$defs/setStep"
        },
        {
          "$ref": "#/$defs/assertStep"
        },
        {
          "$ref": "#/$defs/mergeStep"
        },
        {
          "$ref": "#/$defs/pickStep"
        },
        {
          "$ref": "#/$defs/mapStep"
        },
        {
          "$ref": "#/$defs/filterStep"
        },
        {
          "$ref": "#/$defs/normalizeStep"
        }
      ]
    },
    "setStep": {
      "type": "object",
      "additionalProperties": false,
      "required": ["id", "uses", "with"],
      "properties": {
        "id": {
          "type": "string",
          "pattern": "^[A-Za-z][A-Za-z0-9_-]{0,63}$"
        },
        "uses": {
          "const": "set"
        },
        "with": {
          "type": "object",
          "maxProperties": 10000,
          "additionalProperties": {
            "$ref": "#/$defs/jsonValue"
          }
        }
      }
    },
    "mergeStep": {
      "type": "object",
      "additionalProperties": false,
      "required": ["id", "uses", "with"],
      "properties": {
        "id": {
          "type": "string",
          "pattern": "^[A-Za-z][A-Za-z0-9_-]{0,63}$"
        },
        "uses": {
          "const": "merge"
        },
        "with": {
          "type": "object",
          "additionalProperties": false,
          "required": ["objects"],
          "properties": {
            "objects": {
              "oneOf": [
                {
                  "$ref": "#/$defs/exactTemplate"
                },
                {
                  "type": "array",
                  "maxItems": 10000,
                  "items": {
                    "oneOf": [
                      {
                        "type": "object",
                        "maxProperties": 10000,
                        "additionalProperties": {
                          "$ref": "#/$defs/jsonValue"
                        }
                      },
                      {
                        "$ref": "#/$defs/exactTemplate"
                      }
                    ]
                  }
                }
              ]
            }
          }
        }
      }
    },
    "pickStep": {
      "type": "object",
      "additionalProperties": false,
      "required": ["id", "uses", "with"],
      "properties": {
        "id": {
          "type": "string",
          "pattern": "^[A-Za-z][A-Za-z0-9_-]{0,63}$"
        },
        "uses": {
          "const": "pick"
        },
        "with": {
          "type": "object",
          "additionalProperties": false,
          "required": ["object", "keys"],
          "properties": {
            "object": {
              "oneOf": [
                {
                  "type": "object",
                  "maxProperties": 10000,
                  "additionalProperties": {
                    "$ref": "#/$defs/jsonValue"
                  }
                },
                {
                  "$ref": "#/$defs/exactTemplate"
                }
              ]
            },
            "keys": {
              "oneOf": [
                {
                  "type": "array",
                  "maxItems": 10000,
                  "items": {
                    "type": "string",
                    "maxLength": 100000
                  }
                },
                {
                  "$ref": "#/$defs/exactTemplate"
                }
              ]
            },
            "required": {
              "oneOf": [
                {
                  "type": "boolean"
                },
                {
                  "$ref": "#/$defs/exactTemplate"
                }
              ]
            }
          }
        }
      }
    },
    "collectionItems": {
      "oneOf": [
        {"$ref": "#/$defs/exactTemplate"},
        {"type": "array", "maxItems": 10000, "items": {"$ref": "#/$defs/jsonValue"}}
      ]
    },
    "mapStep": {
      "type": "object",
      "additionalProperties": false,
      "required": ["id", "uses", "with"],
      "properties": {
        "id": {"$ref": "#/$defs/setStep/properties/id"},
        "uses": {"const": "map"},
        "with": {
          "type": "object", "additionalProperties": false,
          "required": ["items", "template"],
          "properties": {
            "items": {"$ref": "#/$defs/collectionItems"},
            "template": {"$ref": "#/$defs/jsonValue"}
          }
        }
      }
    },
    "filterStep": {
      "type": "object",
      "additionalProperties": false,
      "required": ["id", "uses", "with"],
      "properties": {
        "id": {"$ref": "#/$defs/setStep/properties/id"},
        "uses": {"const": "filter"},
        "with": {
          "type": "object", "additionalProperties": false,
          "required": ["items", "where"],
          "properties": {
            "items": {"$ref": "#/$defs/collectionItems"},
            "where": {
              "$ref": "#/$defs/assertStep/properties/with",
              "not": {"required": ["message"]}
            }
          }
        }
      }
    },
    "normalizeStep": {
      "type": "object",
      "additionalProperties": false,
      "required": ["id", "uses", "with"],
      "properties": {
        "id": {"$ref": "#/$defs/setStep/properties/id"},
        "uses": {"const": "normalize"},
        "with": {
          "type": "object", "additionalProperties": false,
          "required": ["value", "transforms"],
          "properties": {
            "value": {
              "oneOf": [
                {"type": "string", "maxLength": 100000},
                {"type": "array", "maxItems": 10000,
                 "items": {"type": "string", "maxLength": 100000}}
              ]
            },
            "transforms": {
              "type": "array", "minItems": 1, "maxItems": 3,
              "items": {"enum": ["trim", "ascii_lower", "ascii_upper"]}
            }
          }
        }
      }
    },
    "assertStep": {
      "type": "object",
      "additionalProperties": false,
      "required": ["id", "uses", "with"],
      "properties": {
        "id": {
          "type": "string",
          "pattern": "^[A-Za-z][A-Za-z0-9_-]{0,63}$"
        },
        "uses": {
          "const": "assert"
        },
        "with": {
          "type": "object",
          "additionalProperties": false,
          "required": ["value", "operator"],
          "properties": {
            "value": {
              "$ref": "#/$defs/jsonValue"
            },
            "operator": {
              "enum": [
                "contains",
                "equals",
                "falsy",
                "greater_or_equal",
                "greater_than",
                "less_or_equal",
                "less_than",
                "not_empty",
                "not_equals",
                "truthy"
              ]
            },
            "expected": {
              "$ref": "#/$defs/jsonValue"
            },
            "message": {
              "type": "string",
              "maxLength": 100000
            }
          },
          "allOf": [
            {
              "if": {
                "properties": {
                  "operator": {
                    "enum": [
                      "contains",
                      "equals",
                      "greater_or_equal",
                      "greater_than",
                      "less_or_equal",
                      "less_than",
                      "not_equals"
                    ]
                  }
                },
                "required": ["operator"]
              },
              "then": {
                "required": ["expected"]
              }
            }
          ]
        }
      }
    }
  }
}
